{
  "$comment": "Phase 14C: evidence ledger. claim_policy const guards enforce that .aieng core does not generate solver, mesh, or CAD geometry evidence.",
  "$id": "https://aieng.dev/schemas/evidence_index.schema.json",
  "$schema": "https://json-schema.org/draft/2020-12/schema",
  "additionalProperties": false,
  "description": "Ledger of evidence items produced by external tools or by .aieng core. Each item records what artifact exists, what kind of producer created it, and what claims it supports. .aieng records this ledger; external tools produce the evidence.",
  "properties": {
    "claim_policy": {
      "additionalProperties": false,
      "description": "Claim policy constraints for the evidence ledger. All flags enforce the execution boundary.",
      "properties": {
        "aieng_core_generates_mesh_evidence": {
          "const": false,
          "description": "Must be false. .aieng core does not generate meshes or mesh evidence.",
          "type": "boolean"
        },
        "aieng_core_generates_solver_evidence": {
          "const": false,
          "description": "Must be false. .aieng core does not run solvers or generate solver evidence.",
          "type": "boolean"
        },
        "aieng_core_modifies_cad_geometry": {
          "const": false,
          "description": "Must be false. .aieng core does not directly modify CAD geometry.",
          "type": "boolean"
        },
        "external_tools_execute": {
          "const": true,
          "description": "Must be true. Solver execution, mesh generation, and CAD modification are performed by external tools only.",
          "type": "boolean"
        }
      },
      "required": [
        "external_tools_execute",
        "aieng_core_generates_solver_evidence",
        "aieng_core_generates_mesh_evidence",
        "aieng_core_modifies_cad_geometry"
      ],
      "type": "object"
    },
    "evidence_index_id": {
      "description": "Stable identifier for this evidence index.",
      "minLength": 1,
      "type": "string"
    },
    "evidence_items": {
      "description": "List of evidence items recorded in this ledger.",
      "items": {
        "additionalProperties": false,
        "properties": {
          "artifact": {
            "additionalProperties": false,
            "properties": {
              "kind": {
                "description": "Artifact file kind.",
                "enum": [
                  "yaml",
                  "json",
                  "inp",
                  "step",
                  "result_file"
                ],
                "type": "string"
              },
              "notes": {
                "description": "Optional notes about the artifact.",
                "type": "string"
              },
              "path": {
                "description": "Path to the artifact within the package, or external reference.",
                "minLength": 1,
                "type": "string"
              }
            },
            "required": [
              "kind",
              "path"
            ],
            "type": "object"
          },
          "claim_support": {
            "description": "Claim IDs from claim_map.json that this evidence item supports.",
            "items": {
              "type": "string"
            },
            "type": "array"
          },
          "evidence_id": {
            "description": "Stable identifier for this evidence item.",
            "minLength": 1,
            "type": "string"
          },
          "evidence_type": {
            "description": "Category of evidence.",
            "enum": [
              "task_spec",
              "external_tool_requirements",
              "solver_result",
              "mesh_evidence",
              "geometry_modification",
              "validation_report"
            ],
            "type": "string"
          },
          "notes": {
            "description": "Optional human-readable notes about this evidence item.",
            "type": "string"
          },
          "producer": {
            "additionalProperties": false,
            "properties": {
              "kind": {
                "description": "Category of producer.",
                "enum": [
                  "aieng_core",
                  "external_cad",
                  "external_cae",
                  "external_solver",
                  "external_agent"
                ],
                "type": "string"
              },
              "notes": {
                "description": "Optional notes about the producer.",
                "type": "string"
              },
              "tool_id": {
                "description": "Optional: tool identifier from candidate_tools if produced by an external tool.",
                "type": "string"
              }
            },
            "required": [
              "kind"
            ],
            "type": "object"
          },
          "structured_payload": {
            "additionalProperties": true,
            "description": "Optional program-readable structured payload recorded with this evidence item.",
            "type": "object"
          },
          "verification": {
            "additionalProperties": false,
            "properties": {
              "notes": {
                "description": "Optional notes about verification.",
                "type": "string"
              },
              "status": {
                "description": "Verification status of this evidence item.",
                "enum": [
                  "available",
                  "missing",
                  "unverified",
                  "schema_validated"
                ],
                "type": "string"
              }
            },
            "required": [
              "status"
            ],
            "type": "object"
          }
        },
        "required": [
          "evidence_id",
          "evidence_type",
          "producer",
          "artifact",
          "claim_support",
          "verification"
        ],
        "type": "object"
      },
      "type": "array"
    },
    "format_version": {
      "const": "0.1.0",
      "type": "string"
    },
    "source_handoff_id": {
      "description": "Optional: handoff_id from task/external_tool_requirements.json if a handoff contract is present.",
      "minLength": 1,
      "type": "string"
    },
    "source_task_id": {
      "description": "Optional: task_id from task/task_spec.yaml if a task spec is present.",
      "minLength": 1,
      "type": "string"
    }
  },
  "required": [
    "format_version",
    "evidence_index_id",
    "evidence_items",
    "claim_policy"
  ],
  "title": ".aieng evidence index",
  "type": "object"
}
